{
  "controlled_vocabulary": {
    "composition_profile": "centered_icon",
    "rarity_band": "rare",
    "render_intent": "candidate",
    "trait_families": [
      "palette",
      "geometry",
      "material",
      "lighting"
    ]
  },
  "detail_priorities": {
    "macro": [
      "anatomy correctness",
      "silhouette clarity",
      "composition hierarchy"
    ],
    "meso": [
      "scale plates",
      "armor structure",
      "secondary architecture"
    ],
    "micro": [
      "erosion",
      "fractures",
      "surface variation"
    ]
  },
  "project": "originx-generative-art-design",
  "prompt": {
    "negative": "generic fantasy, generic cyberpunk, cartoon styling, recognizable franchise design, excessive neon, flat lighting, random ornament, watermark, watermark, text artifacts, logo, extra limbs, broken anatomy",
    "positive": "dark monumental ancient technological presence, physically heavy cinematic form, composition profile centered_icon, rarity band rare, render intent candidate"
  },
  "prompt_id": "master-prompt-token-0001-candidate",
  "provenance_hooks": {
    "catalog_schema_version": "ox-art-spec-expansion-1",
    "hash_required": true,
    "prompt_compiler_version": "OX-MASTER-PROMPT-COMPILER-1"
  },
  "render_binding": {
    "model_requirement": "local diffusion model",
    "runtime_target": "LOCAL_CPP",
    "seed": 7604078333905694560
  },
  "safety_boundaries": {
    "local_first": true,
    "no_external_provider_dependency": true,
    "no_franchise_style": true,
    "no_network": true,
    "no_uncontrolled_text": true
  },
  "schema_version": "ox-master-prompt-1",
  "source": {
    "art_spec_hash": "9be42191a3d38145ddbc5b3461e72a395432e121f3477aef6899617fb53c5a81",
    "identity_input_id": "identity-token-0001",
    "render_plan_hash": "09b690c6224b954a8605d91388300f18d5f9f75aa986822594744a5a5499bc0d"
  }
}
